{
  "record_type": "program",
  "display_order": 93,
  "featured": false,
  "id": "appworks-accelerator-44cb960a",
  "name": "AppWorks Accelerator",
  "name_en": "AppWorks Accelerator",
  "network": "AppWorks",
  "network_en": "AppWorks",
  "score": 57,
  "logo": "/program-logos/appworks-tw.png",
  "logoSource": {
    "Program": "AppWorks Accelerator",
    "Network": "AppWorks",
    "Logo Scope": "Parent network / brand logo",
    "Logo Domain": "appworks.tw",
    "Final Logo URL": "https://logo.clearbit.com/appworks.tw?size=512",
    "Official Direct Asset URL": null,
    "512px Fallback URL": "https://logo.clearbit.com/appworks.tw?size=512",
    "256px Favicon Fallback": "https://www.google.com/s2/favicons?domain=appworks.tw&sz=256",
    "Official Website": "https://appworks.tw/accelerator/",
    "Official Brand / Media Source": "https://appworks.tw/accelerator/",
    "Asset Tier": "C — Official-domain 512px fallback",
    "Preferred Format": "512px PNG fallback",
    "Logo Status": "Logo mapped from official brand domain",
    "Production Note": "Cache the final production asset into Foundshore R2. For Tier B, download the official SVG/PNG from the media kit and replace the fallback URL in production."
  },
  "logoLayout": {
    "asset": "/program-logos/appworks-tw.png",
    "width": 256,
    "height": 256,
    "viewBox": "21 11 214 235"
  },
  "facts_raw": {
    "Program": "AppWorks Accelerator",
    "Network": "AppWorks",
    "Program Type": "Founder Community / Accelerator",
    "Primary Value": "General Acceleration",
    "Foundshore Score": 57,
    "Foundshore Tier": "C",
    "Foundshore Verdict": "低优先级 / 仅特定场景",
    "Region": "Asia",
    "Location": "Taiwan / Greater Southeast Asia",
    "Focus": "AI / web3 / tech",
    "Stage": "Early stage",
    "Capital Type": "No Guaranteed Capital; separate AppWorks fund discussion",
    "Guaranteed Capital": "No",
    "Funding / Support": "Free accelerator; AppWorks fund may invest separately based on company needs/fit",
    "Funding Trigger": "Separate fundraising/investment discussion; joining accelerator does not guarantee funding",
    "Non-dilutive": "Program itself yes",
    "Equity / Economic Terms": "0% accelerator equity; no rent/service fee; no token/options/revenue/profit-sharing compensation",
    "Capital Disclosure Status": "Verified — No Guaranteed Capital",
    "Capital Terms Confidence": "High",
    "Company Required at Application": "No",
    "Geography / Affiliation Restriction": "Global; Taiwan/Asia ecosystem focus",
    "Can Apply Pre-Idea": "Unknown / No",
    "Can Apply Solo": "Unknown",
    "Official / Must-Have Requirements": "Founder-driven application; no revenue requirement; seed through later-stage companies can apply. Current RFS themes are signals, not hard restrictions.",
    "Strong-to-Have": "全职创始团队；清晰 founder-market fit；可演示产品/MVP；真实用户/客户验证；明确下一阶段里程碑与融资用途。",
    "Eligibility Disclosure Status": "Verified / Public",
    "Eligibility Confidence": "High",
    "Format": "Cohort-based",
    "On-site Required": "Flexible hybrid",
    "On-site / Attendance": "Online/offline flexible; in-person participation in Taiwan encouraged but not mandatory in every activity.",
    "Duration": "~4 months",
    "International Founder": "Yes",
    "Visa Support Level": "Immigration Guidance",
    "Visa / Relocation": "Can assist admitted international founders with Taiwan Gold Card / Entrepreneur Visa applications.",
    "Application Status": "AW#33 closed; AW#34 waitlist open",
    "Deadline / Next Intake": "AW#34 waitlist",
    "Application Materials": "Detailed ~30-topic application + required 1-minute founder/CEO self-introduction",
    "Application Link": "https://appworks.tw/accelerator-faq/",
    "Website": "https://appworks.tw/accelerator/",
    "Public Contact Name": null,
    "Public Contact Role": null,
    "Public Email": null,
    "Public Contact Route": "官方申请入口优先；若官网未公开联系人，不建议猜测个人联系方式。",
    "Research Confidence": "High",
    "Last Verified": "2026-09-06",
    "Primary Source": "https://appworks.tw/accelerator-faq/",
    "Verification": "Official 2026",
    "Foundshore Best Fit": "AI / AI-native；Crypto / Web3；阶段以 Early stage 为主。",
    "Foundshore Not Fit": "已进入成熟增长期、仅寻求销售渠道而非创业加速的公司；纯线下传统业务、缺乏可规模化技术产品",
    "Notes": "AW#33 closed as of Aug 2026."
  },
  "facts": {
    "Program": "AppWorks Accelerator",
    "Network": "AppWorks",
    "Program Type": "Founder Community / Accelerator",
    "Primary Value": "General Acceleration",
    "Foundshore Score": 57,
    "Foundshore Tier": "C",
    "Foundshore Verdict": "Lower priority / specialist fit",
    "Region": "Asia",
    "Location": "Taiwan / Greater Southeast Asia",
    "Focus": "AI / web3 / tech",
    "Stage": "Early stage",
    "Capital Type": "No Guaranteed Capital; separate AppWorks fund discussion",
    "Guaranteed Capital": "No",
    "Funding / Support": "Free accelerator; AppWorks fund may invest separately based on company needs/fit",
    "Funding Trigger": "Separate fundraising/investment discussion; joining accelerator does not guarantee funding",
    "Non-dilutive": "Program itself yes",
    "Equity / Economic Terms": "0% accelerator equity; no rent/service fee; no token/options/revenue/profit-sharing compensation",
    "Capital Disclosure Status": "Verified — No Guaranteed Capital",
    "Capital Terms Confidence": "High",
    "Company Required at Application": "No",
    "Geography / Affiliation Restriction": "Global; Taiwan/Asia ecosystem focus",
    "Can Apply Pre-Idea": "Unknown / No",
    "Can Apply Solo": "Unknown",
    "Official / Must-Have Requirements": "Founder-driven application; no revenue requirement; seed through later-stage companies can apply. Current RFS themes are signals, not hard restrictions.",
    "Strong-to-Have": "Full-time founders, clear founder-market fit, a demonstrable MVP, customer validation and explicit milestones and funding needs.",
    "Eligibility Disclosure Status": "Verified / Public",
    "Eligibility Confidence": "High",
    "Format": "Cohort-based",
    "On-site Required": "Flexible hybrid",
    "On-site / Attendance": "Online/offline flexible; in-person participation in Taiwan encouraged but not mandatory in every activity.",
    "Duration": "~4 months",
    "International Founder": "Yes",
    "Visa Support Level": "Immigration Guidance",
    "Visa / Relocation": "Can assist admitted international founders with Taiwan Gold Card / Entrepreneur Visa applications.",
    "Application Status": "AW#33 closed; AW#34 waitlist open",
    "Deadline / Next Intake": "AW#34 waitlist",
    "Application Materials": "Detailed ~30-topic application + required 1-minute founder/CEO self-introduction",
    "Application Link": "https://appworks.tw/accelerator-faq/",
    "Website": "https://appworks.tw/accelerator/",
    "Public Contact Name": null,
    "Public Contact Role": null,
    "Public Email": null,
    "Public Contact Route": "Use the official application. Do not infer private contact information when none is published.",
    "Research Confidence": "High",
    "Last Verified": "2026-09-06",
    "Primary Source": "https://appworks.tw/accelerator-faq/",
    "Verification": "Official 2026",
    "Foundshore Best Fit": "AI / AI-native; Crypto / Web3; primarily at the Early stage stage.",
    "Foundshore Not Fit": "Mature growth companies seeking sales channels rather than acceleration; Traditional offline businesses without a scalable technology product",
    "Notes": "AW#33 closed as of Aug 2026."
  },
  "categories": {
    "type": [
      "Accelerator"
    ],
    "region": [
      "Asia"
    ],
    "stage": [
      "Pre-seed",
      "Seed"
    ],
    "capital": [
      "Conditional funding"
    ],
    "attendance": [
      "Varies by program"
    ],
    "status": [
      "Waitlist"
    ]
  },
  "ranking": {
    "fundingTier": 2,
    "amount": null,
    "currency": null,
    "amountBasis": "Not disclosed",
    "cohortsCompleted": 32,
    "cohortSource": "https://appworks.tw/accelerator/",
    "reputation": null,
    "reputationSource": null
  }
}
