{
  "record_type": "program",
  "display_order": 71,
  "featured": false,
  "id": "masschallenge-switzerland-450d5050",
  "name": "MassChallenge Switzerland",
  "name_en": "MassChallenge Switzerland",
  "network": "MassChallenge",
  "network_en": "MassChallenge",
  "score": 55,
  "logo": "/program-logos/masschallenge-org.png",
  "logoSource": {
    "Program": "MassChallenge Switzerland",
    "Network": "MassChallenge",
    "Logo Scope": "Parent network / brand logo",
    "Logo Domain": "masschallenge.org",
    "Final Logo URL": "https://logo.clearbit.com/masschallenge.org?size=512",
    "Official Direct Asset URL": null,
    "512px Fallback URL": "https://logo.clearbit.com/masschallenge.org?size=512",
    "256px Favicon Fallback": "https://www.google.com/s2/favicons?domain=masschallenge.org&sz=256",
    "Official Website": "https://masschallenge.org/",
    "Official Brand / Media Source": "https://masschallenge.org/",
    "Asset Tier": "C — Official-domain 512px fallback",
    "Preferred Format": "512px PNG fallback",
    "Logo Status": "Logo mapped from official brand domain",
    "Production Note": "Cache the final production asset into Foundshore R2. For Tier B, download the official SVG/PNG from the media kit and replace the fallback URL in production."
  },
  "logoLayout": {
    "asset": "/program-logos/masschallenge-org.png",
    "width": 192,
    "height": 192,
    "viewBox": "13 52 165 93"
  },
  "facts_raw": {
    "Program": "MassChallenge Switzerland",
    "Network": "MassChallenge",
    "Program Type": "Founder Program / Other",
    "Primary Value": "Technical / R&D",
    "Foundshore Score": 55,
    "Foundshore Tier": "C",
    "Foundshore Verdict": "低优先级 / 仅特定场景",
    "Region": "Europe",
    "Location": "Renens, Switzerland",
    "Focus": "Food / materials / industry challenges",
    "Stage": "Prototype–scaleup",
    "Capital Type": "Non-dilutive Grant / Stipend",
    "Guaranteed Capital": "Yes",
    "Funding / Support": "Non-dilutive / partner opportunities",
    "Funding Trigger": "Program-linked / Acceptance (exact timing may vary)",
    "Non-dilutive": "Yes",
    "Equity / Economic Terms": "0% equity for many programs",
    "Capital Disclosure Status": "Verified / Public",
    "Capital Terms Confidence": "High",
    "Company Required at Application": "Unknown / Program-specific",
    "Geography / Affiliation Restriction": "See official eligibility",
    "Can Apply Pre-Idea": "Unknown / No",
    "Can Apply Solo": "Unknown",
    "Official / Must-Have Requirements": "有明确创业团队/项目，能说明产品、市场和团队",
    "Strong-to-Have": "全职创始团队；清晰 founder-market fit；可演示产品/MVP；真实用户/客户验证；明确下一阶段里程碑与融资用途。",
    "Eligibility Disclosure Status": "Verified / Public",
    "Eligibility Confidence": "High",
    "Format": "Hybrid",
    "On-site Required": "Yes / meaningful in-person requirement",
    "On-site / Attendance": "Hybrid；存在必须/高价值线下节点，主要地点：Renens, Switzerland。",
    "Duration": "Program-specific",
    "International Founder": "可能接受国际 founder；需确认签证/现场要求",
    "Visa Support Level": "No / Not Published",
    "Visa / Relocation": "未见公开统一签证支持；若需赴美/赴欧线下参加，必须自行确认合法入境与停留资格。",
    "Application Status": "Upcoming 2027 calls",
    "Deadline / Next Intake": "Sep 2026 reopening for some challenges",
    "Application Materials": "通常需团队/公司/产品/市场/traction/融资信息；具体以当期官方申请表为准。",
    "Application Link": "https://masschallenge.org/",
    "Website": "https://masschallenge.org/",
    "Public Contact Name": null,
    "Public Contact Role": null,
    "Public Email": null,
    "Public Contact Route": "官方申请入口优先；若官网未公开联系人，不建议猜测个人联系方式。",
    "Research Confidence": "High",
    "Last Verified": "2026-09-06",
    "Primary Source": "https://masschallenge.org/our-accelerators/",
    "Verification": "Official 2026",
    "Foundshore Best Fit": "高增长科技创业；阶段以 Prototype–scaleup 为主。",
    "Foundshore Not Fit": "不以 venture-scale 为目标、创始团队无法全职投入、或仅希望获得短期曝光的项目",
    "Notes": "Check specific Swiss challenge."
  },
  "facts": {
    "Program": "MassChallenge Switzerland",
    "Network": "MassChallenge",
    "Program Type": "Founder Program / Other",
    "Primary Value": "Technical / R&D",
    "Foundshore Score": 55,
    "Foundshore Tier": "C",
    "Foundshore Verdict": "Lower priority / specialist fit",
    "Region": "Europe",
    "Location": "Renens, Switzerland",
    "Focus": "Food / materials / industry challenges",
    "Stage": "Prototype–scaleup",
    "Capital Type": "Non-dilutive Grant / Stipend",
    "Guaranteed Capital": "Yes",
    "Funding / Support": "Non-dilutive / partner opportunities",
    "Funding Trigger": "Program-linked / Acceptance (exact timing may vary)",
    "Non-dilutive": "Yes",
    "Equity / Economic Terms": "0% equity for many programs",
    "Capital Disclosure Status": "Verified / Public",
    "Capital Terms Confidence": "High",
    "Company Required at Application": "Unknown / Program-specific",
    "Geography / Affiliation Restriction": "See official eligibility",
    "Can Apply Pre-Idea": "Unknown / No",
    "Can Apply Solo": "Unknown",
    "Official / Must-Have Requirements": "An identifiable team or project with a clear explanation of its product, market and founders",
    "Strong-to-Have": "Full-time founders, clear founder-market fit, a demonstrable MVP, customer validation and explicit milestones and funding needs.",
    "Eligibility Disclosure Status": "Verified / Public",
    "Eligibility Confidence": "High",
    "Format": "Hybrid",
    "On-site Required": "Yes / meaningful in-person requirement",
    "On-site / Attendance": "Hybrid, with required or high-value in-person sessions. Main location: Renens, Switzerland.",
    "Duration": "Program-specific",
    "International Founder": "International founders may be eligible; confirm visa and attendance requirements.",
    "Visa Support Level": "No / Not Published",
    "Visa / Relocation": "No standard visa support published; participants must independently confirm lawful entry and stay for US or European activities.",
    "Application Status": "Upcoming 2027 calls",
    "Deadline / Next Intake": "Sep 2026 reopening for some challenges",
    "Application Materials": "Team, company, product, market, traction and funding information; consult the current official application form.",
    "Application Link": "https://masschallenge.org/",
    "Website": "https://masschallenge.org/",
    "Public Contact Name": null,
    "Public Contact Role": null,
    "Public Email": null,
    "Public Contact Route": "Use the official application. Do not infer private contact information when none is published.",
    "Research Confidence": "High",
    "Last Verified": "2026-09-06",
    "Primary Source": "https://masschallenge.org/our-accelerators/",
    "Verification": "Official 2026",
    "Foundshore Best Fit": "High-growth technology startups; primarily at the Prototype–scaleup stage.",
    "Foundshore Not Fit": "Projects without venture-scale ambitions, founders unable to commit full-time, or teams seeking short-term exposure only.",
    "Notes": "Check specific Swiss challenge."
  },
  "categories": {
    "type": [
      "Community / education"
    ],
    "region": [
      "Europe"
    ],
    "stage": [
      "Pre-seed",
      "Seed",
      "Series A",
      "Growth"
    ],
    "capital": [
      "Grant / stipend"
    ],
    "attendance": [
      "In person"
    ],
    "status": [
      "Upcoming"
    ]
  },
  "ranking": {
    "fundingTier": 3,
    "amount": null,
    "currency": null,
    "amountBasis": "Not disclosed",
    "cohortsCompleted": null,
    "cohortSource": null,
    "reputation": null,
    "reputationSource": null
  }
}
