{
  "record_type": "program",
  "display_order": 106,
  "featured": false,
  "id": "program-a2d97454",
  "name": "创业邦 星际营 / 创业加速服务",
  "name_en": "Cyzone Star Camp / Startup Acceleration",
  "network": "创业邦",
  "network_en": "Cyzone",
  "score": 55,
  "logo": "/program-logos/cyzone-cn.png",
  "logoSource": {
    "Program": "创业邦 星际营 / 创业加速服务",
    "Network": "创业邦",
    "Logo Scope": "Parent network / brand logo",
    "Logo Domain": "cyzone.cn",
    "Final Logo URL": "https://logo.clearbit.com/cyzone.cn?size=512",
    "Official Direct Asset URL": null,
    "512px Fallback URL": "https://logo.clearbit.com/cyzone.cn?size=512",
    "256px Favicon Fallback": "https://www.google.com/s2/favicons?domain=cyzone.cn&sz=256",
    "Official Website": "https://www.cyzone.cn/",
    "Official Brand / Media Source": "https://www.cyzone.cn/",
    "Asset Tier": "C — Official-domain 512px fallback",
    "Preferred Format": "512px PNG fallback",
    "Logo Status": "Logo mapped from official brand domain",
    "Production Note": "Cache the final production asset into Foundshore R2. For Tier B, download the official SVG/PNG from the media kit and replace the fallback URL in production."
  },
  "logoLayout": {
    "asset": "/program-logos/cyzone-cn.png",
    "width": 128,
    "height": 128,
    "viewBox": "12 4 93 120"
  },
  "facts_raw": {
    "Program": "创业邦 星际营 / 创业加速服务",
    "Network": "创业邦",
    "Program Type": "Founder Training / Fundraising Camp",
    "Primary Value": "Capital",
    "Foundshore Score": 55,
    "Foundshore Tier": "C",
    "Foundshore Verdict": "低优先级 / 仅特定场景",
    "Region": "China",
    "Location": "全国",
    "Focus": "早期科技企业",
    "Stage": "Early stage",
    "Capital Type": "No Guaranteed Program Capital; separate 创业邦天使基金 investment",
    "Guaranteed Capital": "No",
    "Funding / Support": "1:1 investor/founder mentoring, fundraising practice, media exposure, industrial connections and DEMO CHINA selection channel; investment is separate",
    "Funding Trigger": "Separate Angel Fund / investor decision, not automatic by camp participation",
    "Non-dilutive": "Unknown",
    "Equity / Economic Terms": "Program-specific",
    "Capital Disclosure Status": "Verified — No Guaranteed Program Capital",
    "Capital Terms Confidence": "High",
    "Company Required at Application": "Unknown / Program-specific",
    "Geography / Affiliation Restriction": "See official eligibility",
    "Can Apply Pre-Idea": "Unknown / No",
    "Can Apply Solo": "Unknown",
    "Official / Must-Have Requirements": "Early technology company/founder; specific cohort application criteria and current fees are not publicly standardized on current overview.",
    "Strong-to-Have": "全职创始团队；清晰 founder-market fit；可演示产品/MVP；真实用户/客户验证；明确下一阶段里程碑与融资用途。",
    "Eligibility Disclosure Status": "Verified — General Program / Cohort-specific Details Not Public",
    "Eligibility Confidence": "High",
    "Format": "创业加速 + 融资对接",
    "On-site Required": "Program-specific",
    "On-site / Attendance": "未公开明确统一要求；按项目地点 全国 和当期 cohort 安排确认。",
    "Duration": "Program-specific",
    "International Founder": "主要面向中国；国际团队需单独确认",
    "Visa Support Level": "No / Not Published",
    "Visa / Relocation": "未见公开统一签证支持；若需赴美/赴欧线下参加，必须自行确认合法入境与停留资格。",
    "Application Status": "Program brand active; current specific cohort intake not clearly published on overview page",
    "Deadline / Next Intake": "Cohort-specific / not currently verified",
    "Application Materials": "通常需团队/公司/产品/市场/traction/融资信息；具体以当期官方申请表为准。",
    "Application Link": "https://special.cyzone.cn/BangCamp/",
    "Website": "https://www.cyzone.cn/",
    "Public Contact Name": null,
    "Public Contact Role": null,
    "Public Email": null,
    "Public Contact Route": "官方申请入口优先；若官网未公开联系人，不建议猜测个人联系方式。",
    "Research Confidence": "High",
    "Last Verified": "2026-09-06",
    "Primary Source": "https://special.cyzone.cn/BangCamp/; https://special.cyzone.cn/special/index/init?special_id=1903",
    "Verification": "Official current program overview",
    "Foundshore Best Fit": "高增长科技创业；阶段以 Early stage 为主。",
    "Foundshore Not Fit": "已进入成熟增长期、仅寻求销售渠道而非创业加速的公司",
    "Notes": "Foundshore: current public materials mix historical outcome data with ongoing product descriptions. Do not show as 'Open' unless a current cohort application page is found."
  },
  "facts": {
    "Program": "Cyzone Star Camp / Startup Acceleration",
    "Network": "Cyzone",
    "Program Type": "Founder Training / Fundraising Camp",
    "Primary Value": "Capital",
    "Foundshore Score": 55,
    "Foundshore Tier": "C",
    "Foundshore Verdict": "Lower priority / specialist fit",
    "Region": "China",
    "Location": "China-wide",
    "Focus": "Early-stage technology companies.",
    "Stage": "Early stage",
    "Capital Type": "No guaranteed program capital; separate investment through the Cyzone angel fund.",
    "Guaranteed Capital": "No",
    "Funding / Support": "1:1 investor/founder mentoring, fundraising practice, media exposure, industrial connections and DEMO CHINA selection channel; investment is separate",
    "Funding Trigger": "Separate Angel Fund / investor decision, not automatic by camp participation",
    "Non-dilutive": "Unknown",
    "Equity / Economic Terms": "Program-specific",
    "Capital Disclosure Status": "Verified — No Guaranteed Program Capital",
    "Capital Terms Confidence": "High",
    "Company Required at Application": "Unknown / Program-specific",
    "Geography / Affiliation Restriction": "See official eligibility",
    "Can Apply Pre-Idea": "Unknown / No",
    "Can Apply Solo": "Unknown",
    "Official / Must-Have Requirements": "Early technology company/founder; specific cohort application criteria and current fees are not publicly standardized on current overview.",
    "Strong-to-Have": "Full-time founders, clear founder-market fit, a demonstrable MVP, customer validation and explicit milestones and funding needs.",
    "Eligibility Disclosure Status": "Verified — General Program / Cohort-specific Details Not Public",
    "Eligibility Confidence": "High",
    "Format": "Startup acceleration and fundraising connections.",
    "On-site Required": "Program-specific",
    "On-site / Attendance": "No standard attendance requirement published. Confirm the current cohort arrangements for China-wide.",
    "Duration": "Program-specific",
    "International Founder": "Primarily China-focused; international teams should confirm eligibility individually.",
    "Visa Support Level": "No / Not Published",
    "Visa / Relocation": "No standard visa support published; participants must independently confirm lawful entry and stay for US or European activities.",
    "Application Status": "Program brand active; current specific cohort intake not clearly published on overview page",
    "Deadline / Next Intake": "Cohort-specific / not currently verified",
    "Application Materials": "Team, company, product, market, traction and funding information; consult the current official application form.",
    "Application Link": "https://special.cyzone.cn/BangCamp/",
    "Website": "https://www.cyzone.cn/",
    "Public Contact Name": null,
    "Public Contact Role": null,
    "Public Email": null,
    "Public Contact Route": "Use the official application. Do not infer private contact information when none is published.",
    "Research Confidence": "High",
    "Last Verified": "2026-09-06",
    "Primary Source": "https://special.cyzone.cn/BangCamp/; https://special.cyzone.cn/special/index/init?special_id=1903",
    "Verification": "Official current program overview",
    "Foundshore Best Fit": "High-growth technology startups; primarily at the Early stage stage.",
    "Foundshore Not Fit": "Mature growth companies seeking sales channels rather than acceleration",
    "Notes": "Foundshore: current public materials mix historical outcome data with ongoing product descriptions. Do not show as 'Open' unless a current cohort application page is found."
  },
  "categories": {
    "type": [
      "Community / education"
    ],
    "region": [
      "Asia"
    ],
    "stage": [
      "Pre-seed",
      "Seed"
    ],
    "capital": [
      "Conditional funding"
    ],
    "attendance": [
      "Varies by program"
    ],
    "status": [
      "To confirm"
    ]
  },
  "ranking": {
    "fundingTier": 2,
    "amount": null,
    "currency": null,
    "amountBasis": "Not disclosed",
    "cohortsCompleted": null,
    "cohortSource": null,
    "reputation": null,
    "reputationSource": null
  }
}
