{
  "record_type": "program",
  "display_order": 114,
  "featured": false,
  "id": "medtech-innovator-us-f4a8c8f4",
  "name": "MedTech Innovator US",
  "name_en": "MedTech Innovator US",
  "network": "MedTech Innovator",
  "network_en": "MedTech Innovator",
  "score": 96,
  "logo": "/program-logos/medtechinnovator-org.png",
  "logoSource": {
    "Program": "MedTech Innovator US",
    "Network": "MedTech Innovator",
    "Logo Scope": "Parent network / brand logo",
    "Logo Domain": "medtechinnovator.org",
    "Final Logo URL": "https://logo.clearbit.com/medtechinnovator.org?size=512",
    "Official Direct Asset URL": null,
    "512px Fallback URL": "https://logo.clearbit.com/medtechinnovator.org?size=512",
    "256px Favicon Fallback": "https://www.google.com/s2/favicons?domain=medtechinnovator.org&sz=256",
    "Official Website": "https://medtechinnovator.org/",
    "Official Brand / Media Source": "https://medtechinnovator.org/",
    "Asset Tier": "C — Official-domain 512px fallback",
    "Preferred Format": "512px PNG fallback",
    "Logo Status": "Logo mapped from official brand domain",
    "Production Note": "Cache the final production asset into Foundshore R2. For Tier B, download the official SVG/PNG from the media kit and replace the fallback URL in production."
  },
  "logoLayout": {
    "asset": "/program-logos/medtechinnovator-org.png",
    "width": 32,
    "height": 32,
    "viewBox": "6 2 22 29"
  },
  "facts_raw": {
    "Program": "MedTech Innovator US",
    "Network": "MedTech Innovator",
    "Program Type": "Founder Program / Other",
    "Primary Value": "Network / Mentorship",
    "Foundshore Score": 96,
    "Foundshore Tier": "S",
    "Foundshore Verdict": "优先推荐",
    "Region": "North America / Global",
    "Location": "Virtual + US events",
    "Focus": "Medtech / diagnostics / digital health",
    "Stage": "Early–mid stage",
    "Capital Type": "Prize / Competition",
    "Guaranteed Capital": "Conditional",
    "Funding / Support": "Competition / non-dilutive funding",
    "Funding Trigger": "Competition / Selection Outcome",
    "Non-dilutive": "Yes",
    "Equity / Economic Terms": "0% equity",
    "Capital Disclosure Status": "Verified / Public",
    "Capital Terms Confidence": "High",
    "Company Required at Application": "Unknown / Program-specific",
    "Geography / Affiliation Restriction": "Generally global / see participation rules",
    "Can Apply Pre-Idea": "Unknown / No",
    "Can Apply Solo": "Unknown",
    "Official / Must-Have Requirements": "early–mid-stage medical device、diagnostic 或 digital health/health IT；最高可到 Series C；最好已有 prototype/PoC 和足够 runway。",
    "Strong-to-Have": "明确 clinical need、regulatory/reimbursement 路径、KOL/clinical validation、强 leadership team。",
    "Eligibility Disclosure Status": "Verified / Public",
    "Eligibility Confidence": "High",
    "Format": "Virtual + required events",
    "On-site Required": "Yes / meaningful in-person requirement",
    "On-site / Attendance": "主体 remote-friendly/virtual；但 accepted company 必须派 cofounder/CEO/高管参加 June Innovator Summit 和 October Showcase/Finals。",
    "Duration": "~4 months",
    "International Founder": "Yes — global companies can apply",
    "Visa Support Level": "Visa Sponsorship",
    "Visa / Relocation": "需能出席美国线下活动；未见统一 visa sponsorship。",
    "Application Status": "Closed for 2026",
    "Deadline / Next Intake": "2027 cycle upcoming",
    "Application Materials": "在线申请；高分公司进入 regional/virtual pitch event；后续 accelerator selection。",
    "Application Link": "https://medtechinnovator.org/apply/",
    "Website": "https://medtechinnovator.org/",
    "Public Contact Name": "MedTech Innovator team",
    "Public Contact Role": "Accelerator",
    "Public Email": null,
    "Public Contact Route": "官方 Apply / info sessions；官网 Contact Us。",
    "Research Confidence": "High",
    "Last Verified": "2026-09-06",
    "Primary Source": "https://medtechinnovator.org/apply/",
    "Verification": "Official 2026",
    "Foundshore Best Fit": "MedTech / Health / Bio；阶段以 Early–mid stage 为主。",
    "Foundshore Not Fit": "已进入成熟增长期、仅寻求销售渠道而非创业加速的公司；缺少核心技术/IP、仅做轻量同质化应用或贸易型项目",
    "Notes": "50+ companies; major industry network."
  },
  "facts": {
    "Program": "MedTech Innovator US",
    "Network": "MedTech Innovator",
    "Program Type": "Founder Program / Other",
    "Primary Value": "Network / Mentorship",
    "Foundshore Score": 96,
    "Foundshore Tier": "S",
    "Foundshore Verdict": "Priority recommendation",
    "Region": "North America / Global",
    "Location": "Virtual + US events",
    "Focus": "Medtech / diagnostics / digital health",
    "Stage": "Early–mid stage",
    "Capital Type": "Prize / Competition",
    "Guaranteed Capital": "Conditional",
    "Funding / Support": "Competition / non-dilutive funding",
    "Funding Trigger": "Competition / Selection Outcome",
    "Non-dilutive": "Yes",
    "Equity / Economic Terms": "0% equity",
    "Capital Disclosure Status": "Verified / Public",
    "Capital Terms Confidence": "High",
    "Company Required at Application": "Unknown / Program-specific",
    "Geography / Affiliation Restriction": "Generally global / see participation rules",
    "Can Apply Pre-Idea": "Unknown / No",
    "Can Apply Solo": "Unknown",
    "Official / Must-Have Requirements": "Early to mid-stage medical device, diagnostics, digital health or health IT companies, potentially through Series C, ideally with a prototype or proof of concept and adequate runway.",
    "Strong-to-Have": "A clear clinical need, regulatory and reimbursement pathway, clinical validation and strong leadership.",
    "Eligibility Disclosure Status": "Verified / Public",
    "Eligibility Confidence": "High",
    "Format": "Virtual + required events",
    "On-site Required": "Yes / meaningful in-person requirement",
    "On-site / Attendance": "Primarily remote or virtual. Each accepted company must send a cofounder, CEO or executive to the June Innovator Summit and October Showcase and Finals.",
    "Duration": "~4 months",
    "International Founder": "Yes — global companies can apply",
    "Visa Support Level": "Visa Sponsorship",
    "Visa / Relocation": "Must be able to attend US activities; no standard visa sponsorship published.",
    "Application Status": "Closed for 2026",
    "Deadline / Next Intake": "2027 cycle upcoming",
    "Application Materials": "Online application; shortlisted companies join regional or virtual pitch events before accelerator selection.",
    "Application Link": "https://medtechinnovator.org/apply/",
    "Website": "https://medtechinnovator.org/",
    "Public Contact Name": "MedTech Innovator team",
    "Public Contact Role": "Accelerator",
    "Public Email": null,
    "Public Contact Route": "Official application, information sessions or Contact Us page.",
    "Research Confidence": "High",
    "Last Verified": "2026-09-06",
    "Primary Source": "https://medtechinnovator.org/apply/",
    "Verification": "Official 2026",
    "Foundshore Best Fit": "MedTech / Health / Bio; primarily at the Early–mid stage stage.",
    "Foundshore Not Fit": "Mature growth companies seeking sales channels rather than acceleration; Projects without core technology or IP, including undifferentiated apps and trading businesses",
    "Notes": "50+ companies; major industry network."
  },
  "categories": {
    "type": [
      "Community / education"
    ],
    "region": [
      "North America",
      "Global"
    ],
    "stage": [
      "Pre-seed",
      "Seed",
      "Series A"
    ],
    "capital": [
      "Prizes"
    ],
    "attendance": [
      "In person"
    ],
    "status": [
      "Closed"
    ]
  },
  "ranking": {
    "fundingTier": 1,
    "amount": null,
    "currency": null,
    "amountBasis": "Not disclosed",
    "cohortsCompleted": null,
    "cohortSource": null,
    "reputation": null,
    "reputationSource": null
  }
}
