{
  "record_type": "program",
  "display_order": 38,
  "featured": false,
  "id": "gener8tor-investment-accelerators-2c7d1c62",
  "name": "gener8tor Investment Accelerators",
  "name_en": "gener8tor Investment Accelerators",
  "network": "gener8tor",
  "network_en": "gener8tor",
  "score": 55,
  "logo": "/program-logos/gener8tor-com.png",
  "logoSource": {
    "Program": "gener8tor Investment Accelerators",
    "Network": "gener8tor",
    "Logo Scope": "Parent network / brand logo",
    "Logo Domain": "gener8tor.com",
    "Final Logo URL": "https://logo.clearbit.com/gener8tor.com?size=512",
    "Official Direct Asset URL": null,
    "512px Fallback URL": "https://logo.clearbit.com/gener8tor.com?size=512",
    "256px Favicon Fallback": "https://www.google.com/s2/favicons?domain=gener8tor.com&sz=256",
    "Official Website": "https://www.gener8tor.com/",
    "Official Brand / Media Source": "https://www.gener8tor.com/",
    "Asset Tier": "C — Official-domain 512px fallback",
    "Preferred Format": "512px PNG fallback",
    "Logo Status": "Logo mapped from official brand domain",
    "Production Note": "Cache the final production asset into Foundshore R2. For Tier B, download the official SVG/PNG from the media kit and replace the fallback URL in production."
  },
  "logoLayout": {
    "asset": "/program-logos/gener8tor-com.png",
    "width": 32,
    "height": 32,
    "viewBox": "8 0 16 32"
  },
  "facts_raw": {
    "Program": "gener8tor Investment Accelerators",
    "Network": "gener8tor",
    "Program Type": "Investment Accelerator Platform",
    "Primary Value": "Capital + Network / Mentorship",
    "Foundshore Score": 55,
    "Foundshore Tier": "C",
    "Foundshore Verdict": "低优先级 / 仅特定场景",
    "Region": "North America",
    "Location": "US multi-city",
    "Focus": "Industry / sector-specific",
    "Stage": "Early stage",
    "Capital Type": "Guaranteed / Program-linked Investment",
    "Guaranteed Capital": "Yes for selected teams; exact deal varies by accelerator",
    "Funding / Support": "Core investment accelerators generally invest around US$100K over 12 weeks; specific programs vary (e.g. $100K for 7.5% SAFE, direct current-round investment, uncapped note, or up to $200K in Saudi).",
    "Funding Trigger": "On selection / program-specific investment documentation",
    "Non-dilutive": "No",
    "Equity / Economic Terms": "Program-specific; many current programs use $100K for 7.5% SAFE, while others use current-round or convertible-note structures.",
    "Capital Disclosure Status": "Verified — Program-specific",
    "Capital Terms Confidence": "High",
    "Company Required at Application": "Unknown / Program-specific",
    "Geography / Affiliation Restriction": "See official eligibility",
    "Can Apply Pre-Idea": "Unknown / No",
    "Can Apply Solo": "Unknown",
    "Official / Must-Have Requirements": "High-growth startup; geography/vertical and relocation requirements depend on selected accelerator.",
    "Strong-to-Have": "全职创始团队；清晰 founder-market fit；可演示产品/MVP；真实用户/客户验证；明确下一阶段里程碑与融资用途。",
    "Eligibility Disclosure Status": "Verified — Program-specific",
    "Eligibility Confidence": "High",
    "Format": "Cohort-based",
    "On-site Required": "Program-specific",
    "On-site / Attendance": "未公开明确统一要求；按项目地点 US multi-city 和当期 cohort 安排确认。",
    "Duration": "12 weeks for Investment Accelerators",
    "International Founder": "可能接受国际 founder；需确认签证/现场要求",
    "Visa Support Level": "No / Not Published",
    "Visa / Relocation": "未见公开统一签证支持；若需赴美/赴欧线下参加，必须自行确认合法入境与停留资格。",
    "Application Status": "Multiple 2026/2027 programs active",
    "Deadline / Next Intake": "Rolling / program-specific",
    "Application Materials": "通常需团队/公司/产品/市场/traction/融资信息；具体以当期官方申请表为准。",
    "Application Link": "https://www.gener8tor.com/apply",
    "Website": "https://www.gener8tor.com/",
    "Public Contact Name": null,
    "Public Contact Role": null,
    "Public Email": null,
    "Public Contact Route": "官方申请入口优先；若官网未公开联系人，不建议猜测个人联系方式。",
    "Research Confidence": "High",
    "Last Verified": "2026-09-06",
    "Primary Source": "https://www.gener8tor.com/investment-accelerators",
    "Verification": "Official current",
    "Foundshore Best Fit": "高增长科技创业；阶段以 Early stage 为主。",
    "Foundshore Not Fit": "已进入成熟增长期、仅寻求销售渠道而非创业加速的公司",
    "Notes": "Foundshore: split child records before making exact deal/relocation recommendations."
  },
  "facts": {
    "Program": "gener8tor Investment Accelerators",
    "Network": "gener8tor",
    "Program Type": "Investment Accelerator Platform",
    "Primary Value": "Capital + Network / Mentorship",
    "Foundshore Score": 55,
    "Foundshore Tier": "C",
    "Foundshore Verdict": "Lower priority / specialist fit",
    "Region": "North America",
    "Location": "US multi-city",
    "Focus": "Industry / sector-specific",
    "Stage": "Early stage",
    "Capital Type": "Guaranteed / Program-linked Investment",
    "Guaranteed Capital": "Yes for selected teams; exact deal varies by accelerator",
    "Funding / Support": "Core investment accelerators generally invest around US$100K over 12 weeks; specific programs vary (e.g. $100K for 7.5% SAFE, direct current-round investment, uncapped note, or up to $200K in Saudi).",
    "Funding Trigger": "On selection / program-specific investment documentation",
    "Non-dilutive": "No",
    "Equity / Economic Terms": "Program-specific; many current programs use $100K for 7.5% SAFE, while others use current-round or convertible-note structures.",
    "Capital Disclosure Status": "Verified — Program-specific",
    "Capital Terms Confidence": "High",
    "Company Required at Application": "Unknown / Program-specific",
    "Geography / Affiliation Restriction": "See official eligibility",
    "Can Apply Pre-Idea": "Unknown / No",
    "Can Apply Solo": "Unknown",
    "Official / Must-Have Requirements": "High-growth startup; geography/vertical and relocation requirements depend on selected accelerator.",
    "Strong-to-Have": "Full-time founders, clear founder-market fit, a demonstrable MVP, customer validation and explicit milestones and funding needs.",
    "Eligibility Disclosure Status": "Verified — Program-specific",
    "Eligibility Confidence": "High",
    "Format": "Cohort-based",
    "On-site Required": "Program-specific",
    "On-site / Attendance": "No standard attendance requirement published. Confirm the current cohort arrangements for US multi-city.",
    "Duration": "12 weeks for Investment Accelerators",
    "International Founder": "International founders may be eligible; confirm visa and attendance requirements.",
    "Visa Support Level": "No / Not Published",
    "Visa / Relocation": "No standard visa support published; participants must independently confirm lawful entry and stay for US or European activities.",
    "Application Status": "Multiple 2026/2027 programs active",
    "Deadline / Next Intake": "Rolling / program-specific",
    "Application Materials": "Team, company, product, market, traction and funding information; consult the current official application form.",
    "Application Link": "https://www.gener8tor.com/apply",
    "Website": "https://www.gener8tor.com/",
    "Public Contact Name": null,
    "Public Contact Role": null,
    "Public Email": null,
    "Public Contact Route": "Use the official application. Do not infer private contact information when none is published.",
    "Research Confidence": "High",
    "Last Verified": "2026-09-06",
    "Primary Source": "https://www.gener8tor.com/investment-accelerators",
    "Verification": "Official current",
    "Foundshore Best Fit": "High-growth technology startups; primarily at the Early stage stage.",
    "Foundshore Not Fit": "Mature growth companies seeking sales channels rather than acceleration",
    "Notes": "Foundshore: split child records before making exact deal/relocation recommendations."
  },
  "categories": {
    "type": [
      "Accelerator"
    ],
    "region": [
      "North America"
    ],
    "stage": [
      "Pre-seed",
      "Seed"
    ],
    "capital": [
      "Investment"
    ],
    "attendance": [
      "Varies by program"
    ],
    "status": [
      "To confirm"
    ]
  },
  "ranking": {
    "fundingTier": 3,
    "amount": 100000,
    "currency": "USD",
    "amountBasis": "Published initial amount / range minimum",
    "cohortsCompleted": null,
    "cohortSource": null,
    "reputation": null,
    "reputationSource": null
  }
}
