{
  "record_type": "program",
  "display_order": 47,
  "featured": false,
  "id": "alchemist-chicago-f01f1850",
  "name": "Alchemist Chicago",
  "name_en": "Alchemist Chicago",
  "network": "Alchemist",
  "network_en": "Alchemist",
  "score": 54,
  "logo": "/program-logos/alchemistaccelerator-com.png",
  "logoSource": {
    "Program": "Alchemist Chicago",
    "Network": "Alchemist",
    "Logo Scope": "Parent network / brand logo",
    "Logo Domain": "alchemistaccelerator.com",
    "Final Logo URL": "https://logo.clearbit.com/alchemistaccelerator.com?size=512",
    "Official Direct Asset URL": null,
    "512px Fallback URL": "https://logo.clearbit.com/alchemistaccelerator.com?size=512",
    "256px Favicon Fallback": "https://www.google.com/s2/favicons?domain=alchemistaccelerator.com&sz=256",
    "Official Website": "https://www.alchemistaccelerator.com/alchemist-chicago",
    "Official Brand / Media Source": "https://www.alchemistaccelerator.com/alchemist-chicago",
    "Asset Tier": "C — Official-domain 512px fallback",
    "Preferred Format": "512px PNG fallback",
    "Logo Status": "Logo mapped from official brand domain",
    "Production Note": "Cache the final production asset into Foundshore R2. For Tier B, download the official SVG/PNG from the media kit and replace the fallback URL in production."
  },
  "logoLayout": {
    "asset": "/program-logos/alchemistaccelerator-com.png",
    "width": 256,
    "height": 256,
    "viewBox": "13 0 230 256"
  },
  "facts_raw": {
    "Program": "Alchemist Chicago",
    "Network": "Alchemist",
    "Program Type": "Accelerator",
    "Primary Value": "Capital",
    "Foundshore Score": 54,
    "Foundshore Tier": "C",
    "Foundshore Verdict": "低优先级 / 仅特定场景",
    "Region": "North America",
    "Location": "Chicago, US",
    "Focus": "Deep tech",
    "Stage": "Pre-seed–seed",
    "Capital Type": "Guaranteed / Program-linked Investment",
    "Guaranteed Capital": "Yes",
    "Funding / Support": "US$50K SAFE for finalists",
    "Funding Trigger": "Program-linked / Acceptance (exact timing may vary)",
    "Non-dilutive": "No / Mixed",
    "Equity / Economic Terms": "~4% anticipated for advancing companies; flexible terms",
    "Capital Disclosure Status": "Verified / Public",
    "Capital Terms Confidence": "High",
    "Company Required at Application": "Unknown / Program-specific",
    "Geography / Affiliation Restriction": "See official eligibility",
    "Can Apply Pre-Idea": "Unknown / No",
    "Can Apply Solo": "Unknown",
    "Official / Must-Have Requirements": "有明确创业团队/项目，能说明产品、市场和团队；核心技术/产品与项目垂直领域匹配；公司阶段应处于早期，通常不应已明显超出 seed 阶段",
    "Strong-to-Have": "全职创始团队；清晰 founder-market fit；可演示产品/MVP；真实用户/客户验证；明确下一阶段里程碑与融资用途。",
    "Eligibility Disclosure Status": "Verified / Public",
    "Eligibility Confidence": "High",
    "Format": "In-person / hybrid",
    "On-site Required": "Program-specific",
    "On-site / Attendance": "需要或强烈依赖线下参与；主要地点：Chicago, US。",
    "Duration": "Cohort-based",
    "International Founder": "可能接受国际 founder；需确认签证/现场要求",
    "Visa Support Level": "No / Not Published",
    "Visa / Relocation": "未见公开统一签证支持；若需赴美/赴欧线下参加，必须自行确认合法入境与停留资格。",
    "Application Status": "Closed",
    "Deadline / Next Intake": "Aug 20, 2026",
    "Application Materials": "通常需团队/公司/产品/市场/traction/融资信息；具体以当期官方申请表为准。",
    "Application Link": "https://www.alchemistaccelerator.com/alchemist-chicago",
    "Website": "https://www.alchemistaccelerator.com/alchemist-chicago",
    "Public Contact Name": null,
    "Public Contact Role": null,
    "Public Email": null,
    "Public Contact Route": "官方申请入口优先；若官网未公开联系人，不建议猜测个人联系方式。",
    "Research Confidence": "High",
    "Last Verified": "2026-09-06",
    "Primary Source": "https://www.alchemistaccelerator.com/alchemist-chicago",
    "Verification": "Official 2026",
    "Foundshore Best Fit": "硬件 / 机器人 / DeepTech；阶段以 Pre-seed–seed 为主。",
    "Foundshore Not Fit": "已进入成熟增长期、仅寻求销售渠道而非创业加速的公司；缺少核心技术/IP、仅做轻量同质化应用或贸易型项目",
    "Notes": "Bootcamp then accelerator selection."
  },
  "facts": {
    "Program": "Alchemist Chicago",
    "Network": "Alchemist",
    "Program Type": "Accelerator",
    "Primary Value": "Capital",
    "Foundshore Score": 54,
    "Foundshore Tier": "C",
    "Foundshore Verdict": "Lower priority / specialist fit",
    "Region": "North America",
    "Location": "Chicago, US",
    "Focus": "Deep tech",
    "Stage": "Pre-seed–seed",
    "Capital Type": "Guaranteed / Program-linked Investment",
    "Guaranteed Capital": "Yes",
    "Funding / Support": "US$50K SAFE for finalists",
    "Funding Trigger": "Program-linked / Acceptance (exact timing may vary)",
    "Non-dilutive": "No / Mixed",
    "Equity / Economic Terms": "~4% anticipated for advancing companies; flexible terms",
    "Capital Disclosure Status": "Verified / Public",
    "Capital Terms Confidence": "High",
    "Company Required at Application": "Unknown / Program-specific",
    "Geography / Affiliation Restriction": "See official eligibility",
    "Can Apply Pre-Idea": "Unknown / No",
    "Can Apply Solo": "Unknown",
    "Official / Must-Have Requirements": "An identifiable team or project with a clear explanation of its product, market and founders; The core technology or product must match the program vertical; The company should be early-stage, generally no later than seed",
    "Strong-to-Have": "Full-time founders, clear founder-market fit, a demonstrable MVP, customer validation and explicit milestones and funding needs.",
    "Eligibility Disclosure Status": "Verified / Public",
    "Eligibility Confidence": "High",
    "Format": "In-person / hybrid",
    "On-site Required": "Program-specific",
    "On-site / Attendance": "In-person participation is required or central to the program. Main location: Chicago, US.",
    "Duration": "Cohort-based",
    "International Founder": "International founders may be eligible; confirm visa and attendance requirements.",
    "Visa Support Level": "No / Not Published",
    "Visa / Relocation": "No standard visa support published; participants must independently confirm lawful entry and stay for US or European activities.",
    "Application Status": "Closed",
    "Deadline / Next Intake": "Aug 20, 2026",
    "Application Materials": "Team, company, product, market, traction and funding information; consult the current official application form.",
    "Application Link": "https://www.alchemistaccelerator.com/alchemist-chicago",
    "Website": "https://www.alchemistaccelerator.com/alchemist-chicago",
    "Public Contact Name": null,
    "Public Contact Role": null,
    "Public Email": null,
    "Public Contact Route": "Use the official application. Do not infer private contact information when none is published.",
    "Research Confidence": "High",
    "Last Verified": "2026-09-06",
    "Primary Source": "https://www.alchemistaccelerator.com/alchemist-chicago",
    "Verification": "Official 2026",
    "Foundshore Best Fit": "Hardware / Robotics / DeepTech; primarily at the Pre-seed–seed stage.",
    "Foundshore Not Fit": "Mature growth companies seeking sales channels rather than acceleration; Projects without core technology or IP, including undifferentiated apps and trading businesses",
    "Notes": "Bootcamp then accelerator selection."
  },
  "categories": {
    "type": [
      "Accelerator"
    ],
    "region": [
      "North America"
    ],
    "stage": [
      "Pre-seed",
      "Seed"
    ],
    "capital": [
      "Investment"
    ],
    "attendance": [
      "Varies by program"
    ],
    "status": [
      "Closed"
    ]
  },
  "ranking": {
    "fundingTier": 3,
    "amount": 50000,
    "currency": "USD",
    "amountBasis": "Published initial amount / range minimum",
    "cohortsCompleted": null,
    "cohortSource": null,
    "reputation": null,
    "reputationSource": null
  }
}
